[{"pic": null, "id": "1433721693547904_1730326893887381", "source": "Metakgp", "message": "<b>Metakgp shared their post.</b> <br>  <br> MFQP is working again. The library site for previous year papers has been down for most of this exam session, and since MFQP linked to the papers from there, the papers were not accessible. We have found a work-around now, and we are serving the papers from another file server.  <br>  <br> You can prepare productively with access to QPs again. (Note that this is an archive of papers from 2014, so papers from 2015 won't be available) <br>  <br>  <a href=\"http://qp.metakgp.org\" target=\"_blank\"> http://qp.metakgp.org </a> /", "real_date": "16-09-2016", "created_time": "2016-09-16T05:31:51+0000", "link": "http://qp.metakgp.org/", "story": "Metakgp shared their post.", "flag": 1, "real_time": "11:01AM"}, {"pic": null, "id": "1433721693547904_1730326263887444", "source": "Metakgp", "message": "MFQP is working again. The library site for previous year papers has been down for most of this exam session, and since MFQP linked to the papers from there, the papers were not accessible. We have found a work-around now, and we are serving the papers from another file server.  <br>  <br> You can prepare productively with access to QPs again. (Note that this is an archive of papers from 2014, so papers from 2015 won't be available) <br>  <br>  <a href=\"http://qp.metakgp.org\" target=\"_blank\"> http://qp.metakgp.org </a> /", "real_date": "16-09-2016", "created_time": "2016-09-16T05:29:00+0000", "link": "http://qp.metakgp.org/", "flag": 1, "real_time": "10:59AM"}, {"pic": "1215819375105082.png", "id": "146188872068143_1215819375105082", "source": "Awaaz IIT Kharagpur", "message": "After a number of activities around Hall swap, first being allowed then banned, finally hall swap has been officially announced with few procedural conditions. However, this practice will be banned from next year onwards. <br> One can have a look on the official notice regarding the mutual hall swap of 2nd year UG students.", "real_date": "15-09-2016", "created_time": "2016-09-15T17:55:44+0000", "link": "https://www.facebook.com/awaaziitkgp/photos/a.146211918732505.22874.146188872068143/1215819375105082/?type=3", "flag": 1, "real_time": "11:25PM"}, {"pic": null, "id": "149405445074499_363591260696106", "source": "Technology Students Gymkhana", "message": "World\u2019s first solar charger that can be placed inside your note or planner. It is a paper thin and ultra light weight solar charger.", "real_date": "15-09-2016", "created_time": "2016-09-14T23:50:35+0000", "link": "http://www.hopeforeverybody.com/solar-paper-the-worlds-thinnest-and-lightest-solar-charger/", "flag": 1, "real_time": "05:20AM"}, {"pic": null, "id": "146188872068143_1214888641864822", "source": "Awaaz IIT Kharagpur", "message": "The dates of Spring Fest and Kshitij have been rescheduled. The new dates are: <br> Spring Fest 2017 - 20th - 22nd January 2017 <br> Kshitij 2017 - 27th - 29th January 2017 <br>  <br> Although the dates have changed it is important here to notice the reduction in the number of days. Now the fest will be of two and half days only instead of the regular 3.5 days. <br>  <br> News Credits : VP TSG", "real_date": "14-09-2016", "created_time": "2016-09-14T13:14:19+0000", "link": null, "flag": 1, "real_time": "06:44PM"}, {"pic": "307287719651717.png", "id": "149405445074499_307287719651717", "source": "Technology Students Gymkhana", "message": "#Busigence is a Decision Intelligence Company. We build #DataProducts using #DataScience, #ArtificialIntelligence  & #DesignThinking concepts. We are looking for #Marketer (#GrowthHacker) who can work on our #promotions & #marketing. #INTERNS are also welcome. #APPLY here ( <a href=\"http://bit.ly/2c8ekAz\" target=\"_blank\"> http://bit.ly/2c8ekAz </a> )     or mail your CV to careers@ <a href=\"http://busigence.com\" target=\"_blank\"> busigence.com </a> .", "real_date": "14-09-2016", "created_time": "2016-09-14T11:55:04+0000", "link": "https://www.facebook.com/photo.php?fbid=307287719651717&set=o.149405445074499&type=3", "flag": 1, "real_time": "05:25PM"}, {"pic": "1214221498598203.png", "id": "146188872068143_1214223388598014", "source": "Awaaz IIT Kharagpur", "message": "\u0939\u093f\u0928\u094d\u0926\u0940 \u092c\u0928\u0947 \u0938\u0947\u0924\u0941 \u0939\u0943\u0926\u092f\u094b\u0902 \u0915\u093e, \u0915\u094b\u091f\u093f-\u0915\u094b\u091f\u093f \u091c\u0928\u0924\u093e \u0915\u0940 \u091c\u092f \u0939\u094b; \u0938\u093e\u0930\u0940 \u0935\u0938\u0941\u0927\u093e \u090f\u0915 \u0939\u094d\u0930\u0926\u092f \u0939\u094b\u0964 \u0939\u093f\u0928\u094d\u0926\u0940 \u0915\u0947 \u092a\u094d\u0930\u092f\u094b\u0917 \u092e\u0947\u0902 \u0938\u094d\u0935\u093e\u092d\u093f\u092e\u093e\u0928 \u0915\u093e \u0905\u0928\u0941\u092d\u0935 \u0915\u0930\u0947\u0902, \u0938\u0902\u0915\u094b\u091a \u0915\u093e \u0928\u0939\u0940\u0902\u0964 - \u0938\u0942\u0930\u094d\u092f\u0915\u093e\u0928\u094d\u0924 \u0924\u094d\u0930\u093f\u092a\u093e\u0920\u0940 '\u0928\u093f\u0930\u093e\u0932\u093e'  <br>  <br> \u091c\u092f \u0939\u093f\u0928\u094d\u0926, \u091c\u092f \u0939\u093f\u0928\u094d\u0926\u0940", "real_date": "14-09-2016", "created_time": "2016-09-13T18:40:06+0000", "link": "https://www.facebook.com/awaaziitkgp/photos/a.362016570485371.85116.146188872068143/1214221498598203/?type=3", "story": "Awaaz, IIT Kharagpur updated their cover photo.", "flag": 1, "real_time": "12:10AM"}, {"pic": "1048146175307957.png", "id": "149405445074499_1048146175307957", "source": "Technology Students Gymkhana", "message": "Today organizations need to become driven faster and turning to the apps will help get them there:  <a href=\"http://bit.ly/2ce6nA1\" target=\"_blank\"> http://bit.ly/2ce6nA1 </a>  <br>  <br> #businessanalyst #businessdevelopment #businessmarketing #mobileapps #applications", "real_date": "13-09-2016", "created_time": "2016-09-13T12:00:53+0000", "link": "https://www.facebook.com/SureVin/photos/o.149405445074499/1048146175307957/?type=3", "flag": 1, "real_time": "05:30PM"}, {"pic": "1213232512030435.png", "id": "146188872068143_1213232512030435", "source": "Awaaz IIT Kharagpur", "message": "\u0915\u093f\u0938\u0940 \u092d\u0940 \u0926\u0947\u0936 \u0915\u0947 \u0909\u0924\u094d\u0925\u093e\u0928 \u092e\u0947\u0902 \u0909\u0938 \u0926\u0947\u0936 \u0915\u0940 \u092d\u093e\u0937\u093e \u0915\u0940 \u0905\u0924\u094d\u092f\u0928\u094d\u0924 \u092e\u0939\u0924\u094d\u0924\u094d\u0935\u092a\u0942\u0930\u094d\u0923 \u092d\u0942\u092e\u093f\u0915\u093e \u0939\u094b\u0924\u0940 \u0939\u0948\u0964 \u092d\u093e\u0930\u0924\u0940\u092f \u0938\u0902\u0935\u093f\u0927\u093e\u0928 \u0928\u0947 14 \u0938\u093f\u0924\u092e\u094d\u092c\u0930 1949 \u0915\u094b \u0939\u093f\u0902\u0926\u0940 \u0915\u094b \u092d\u093e\u0930\u0924 \u0915\u0940 \u0930\u093e\u091c\u092d\u093e\u0937\u093e \u0918\u094b\u0937\u093f\u0924 \u0915\u093f\u092f\u093e \u0925\u093e\u0964 14 \u0938\u093f\u0924\u092e\u094d\u092c\u0930 \u0915\u094b \u0939\u093f\u0902\u0926\u0940 \u0926\u093f\u0935\u0938 \u0915\u0947 \u0905\u0935\u0938\u0930 \u092a\u0930 \u0930\u093e\u091c\u092d\u093e\u0937\u093e \u0935\u093f\u092d\u093e\u0917, \u0906\u0908\u0906\u0908\u091f\u0940 \u0916\u095c\u0917\u092a\u0941\u0930 \u0939\u093f\u0902\u0926\u0940 \u092d\u093e\u0937\u093e \u0915\u0947 \u092a\u094d\u0930\u091a\u093e\u0930 \u092a\u094d\u0930\u0938\u093e\u0930 \u0915\u0947 \u0932\u093f\u090f \u0935\u093f\u092d\u093f\u0928\u094d\u0928 \u0915\u093e\u0930\u094d\u092f\u0915\u094d\u0930\u092e\u094b\u0902 \u0915\u093e \u0906\u092f\u094b\u091c\u0928 \u0915\u0930 \u0930\u0939\u093e \u0939\u0948 \u091c\u093f\u0938\u092e\u0947\u0902 \u0938\u092d\u0940 \u091b\u093e\u0924\u094d\u0930 \u0938\u093e\u0926\u0930 \u0906\u092e\u0902\u0924\u094d\u0930\u093f\u0924 \u0939\u0948\u0902\u0964  <br> \u0926\u093f\u0928\u093e\u0901\u0915 - 14 \u0938\u093f\u0924\u092e\u094d\u092c\u0930  <br> \u0938\u092e\u092f   - 11 am - \u0905\u0924\u093f\u0925\u093f \u0935\u094d\u092f\u093e\u0916\u094d\u092f\u093e\u0928 - \u0936\u094d\u0930\u0940 \u0930\u093e\u0939\u0941\u0932 \u0926\u0947\u0935  <br>               5 pm  - \u0938\u0902\u0935\u093e\u0926 - \u0936\u094d\u0930\u0940 \u0930\u093e\u0939\u0941\u0932 \u0926\u0947\u0935  <br> \u0938\u094d\u0925\u093e\u0928  -  \u092a\u094d\u0930\u094b. \u090f\u0938 \u090f\u0928 \u092c\u094b\u0938 \u092a\u094d\u0930\u0947\u0915\u094d\u0937\u093e\u0917\u0943\u0939", "real_date": "12-09-2016", "created_time": "2016-09-12T12:45:26+0000", "link": "https://www.facebook.com/awaaziitkgp/photos/a.146211918732505.22874.146188872068143/1213232512030435/?type=3", "flag": 1, "real_time": "06:15PM"}, {"pic": "1391962137498701.png", "id": "149405445074499_1391962137498701", "source": "Technology Students Gymkhana", "message": "\u0905\u0928\u0941\u0930\u094b\u0927 \u0939\u0948 \u0915\u093f  \u0907\u0938\u0947 \u0905\u092a\u0928\u0947 \u0938\u092d\u0940 \u0917\u094d\u0930\u0941\u092a\u094b\u0902 \u092e\u0947\u0902 \u092a\u094b\u0938\u094d\u091f \u0915\u0930\u0947\u0902\u0964 \u0930\u093e\u091c\u092d\u093e\u0937\u093e \u0939\u093f\u0902\u0926\u0940 \u0915\u0947 \u092a\u094d\u0930\u091a\u093e\u0930 \u092a\u094d\u0930\u0938\u093e\u0930 \u092e\u0947\u0902 \u0938\u0939\u092f\u094b\u0917\u0940 \u092c\u0928\u093f\u090f\u0964  \u0907\u0928 \u0915\u093e\u0930\u094d\u092f\u0915\u094d\u0930\u092e\u094b\u0902 \u092e\u0947\u0902 \u0938\u092d\u0940 \u092d\u093e\u0930\u0924\u0940\u092f \u092d\u093e\u0937\u093e \u092a\u094d\u0930\u0947\u092e\u093f\u092f\u094b\u0902 \u0915\u093e \u0938\u094d\u0935\u093e\u0917\u0924 \u0939\u0948\u0964", "real_date": "12-09-2016", "created_time": "2016-09-12T08:56:05+0000", "link": "https://www.facebook.com/photo.php?fbid=1391962137498701&set=o.149405445074499&type=3", "flag": 1, "real_time": "02:26PM"}, {"pic": "1391961397498775.png", "id": "149405445074499_1391961397498775", "source": "Technology Students Gymkhana", "message": "\u0905\u0928\u0941\u0930\u094b\u0927 \u0939\u0948 \u0915\u093f  \u0907\u0938\u0947 \u0905\u092a\u0928\u0947 \u0938\u092d\u0940 \u0917\u094d\u0930\u0941\u092a\u094b\u0902 \u092e\u0947\u0902 \u092a\u094b\u0938\u094d\u091f \u0915\u0930\u0947\u0902\u0964 \u0930\u093e\u091c\u092d\u093e\u0937\u093e \u0939\u093f\u0902\u0926\u0940 \u0915\u0947 \u092a\u094d\u0930\u091a\u093e\u0930 \u092a\u094d\u0930\u0938\u093e\u0930 \u092e\u0947\u0902 \u0938\u0939\u092f\u094b\u0917\u0940 \u092c\u0928\u093f\u090f\u0964  \u0907\u0928 \u0915\u093e\u0930\u094d\u092f\u0915\u094d\u0930\u092e\u094b\u0902 \u092e\u0947\u0902 \u0938\u092d\u0940 \u092d\u093e\u0930\u0924\u0940\u092f \u092d\u093e\u0937\u093e \u092a\u094d\u0930\u0947\u092e\u093f\u092f\u094b\u0902 \u0915\u093e \u0938\u094d\u0935\u093e\u0917\u0924 \u0939\u0948\u0964", "real_date": "12-09-2016", "created_time": "2016-09-12T08:55:09+0000", "link": "https://www.facebook.com/photo.php?fbid=1391961397498775&set=o.149405445074499&type=3", "flag": 1, "real_time": "02:25PM"}, {"pic": null, "id": "1433721693547904_1728854127367991", "source": "Metakgp", "message": "*The link is for the Previous Year Question Papers* <br> With the blood-curdling countdown to midsems almost coming to an end, some of us would like to know what exactly the previous generations have faced. The Scholars' Avenue proudly presents to you the one stop shop for PYQPs, the sweat and blood of Metakgp and the unbuttoned sensation of KGP,  <a href=\"http://qp.metakgp.org\" target=\"_blank\"> http://qp.metakgp.org </a> /", "real_date": "12-09-2016", "created_time": "2016-09-12T07:40:35+0000", "link": "http://qp.metakgp.org/", "flag": 1, "real_time": "01:10PM"}, {"pic": null, "id": "156819310131_10154401473910132", "source": "The Scholar's Avenue", "message": "*The link is for the Previous Year Question Papers* <br> With the blood-curdling countdown to midsems almost coming to an end, some of us would like to know what exactly the previous generations have faced. The Scholars' Avenue proudly presents to you the one stop shop for PYQPs, the sweat and blood of Metakgp and the unbuttoned sensation of KGP,  <a href=\"http://qp.metakgp.org\" target=\"_blank\"> http://qp.metakgp.org </a> /", "real_date": "12-09-2016", "created_time": "2016-09-12T07:40:34+0000", "link": "http://qp.metakgp.org/", "flag": 1, "real_time": "01:10PM"}, {"pic": null, "id": "146188872068143_1212533188767034", "source": "Awaaz IIT Kharagpur", "message": "\u0910\u0938\u0947 \u092e\u0947\u0902 \u091c\u092c \u092a\u0942\u0930\u093e \u0915\u0948\u0902\u092a\u0938 \u092a\u0930\u0940\u0915\u094d\u0937\u093e\u0913\u0902 \u0915\u0940 \u0906\u0939\u091f \u092e\u0939\u0938\u0942\u0938 \u0915\u0930 \u0930\u0939\u093e \u0939\u0948,  <br> \u0906\u0935\u093e\u091c\u093c , IIT Kharagpur \u092a\u094d\u0930\u0938\u094d\u0924\u0941\u0924 \u0915\u0930\u0924\u0947 \u0939\u0948\u0902 \u0938\u093f\u0924\u092e\u094d\u092c\u0930 2016 \u0915\u093e \u092f\u0947 \u0905\u0902\u0915 | \u0906\u0908\u0906\u0908\u091f\u0940 \u0915\u0940 \u092b\u0940\u0938 \u092e\u0947\u0902 \u092c\u095d\u094b\u0924\u0930\u0940 \u0915\u093e \u0935\u093f\u0937\u092f \u0939\u094b \u092f\u093e \u0921\u093f\u092a\u093e\u0930\u094d\u091f\u092e\u0947\u0902\u091f \u091a\u0947\u0902\u091c \u0915\u093e \u0935\u093f\u0936\u094d\u0932\u0947\u0937\u0923, \u0938\u092c \u0915\u0941\u091b \u092e\u094c\u091c\u0942\u0926 \u0939\u0948 \u0907\u0938 \u0905\u0902\u0915 \u092e\u0947\u0902 | \u092a\u095d\u093e\u0908 \u0938\u0947 \u0925\u094b\u095c\u093e \u0938\u092e\u092f \u0928\u093f\u0915\u093e\u0932\u093f\u092f\u0947 \u0914\u0930 \u0907\u0938\u0915\u093e \u0906\u0928\u0902\u0926 \u0909\u0920\u093e\u0907\u092f\u0947\u0964 <br>  <a href=\"https://issuu.com/awaaz/docs/september__2016/1\" target=\"_blank\"> https://issuu.com/awaaz/d... </a> ", "real_date": "11-09-2016", "created_time": "2016-09-11T15:09:39+0000", "link": "https://issuu.com/awaaz/docs/september__2016/1", "flag": 1, "real_time": "08:39PM"}, {"pic": "1404389702909394.png", "id": "149405445074499_1404389702909394", "source": "Technology Students Gymkhana", "message": "The submission deadline for the Science of Happiness Challenge has been extended to 18th September!! <br> This is your chance to take a step towards building a happier society. <br> Register at   <a href=\"http://www.happiness-iitkgp.org/happiness/registration.php\" target=\"_blank\"> http://www.happiness-iitk... </a>  to take part in the competitions and to be a part of the 1st International Workshop in campus on the Science of Happiness on 24th and 25th September!! <br>  <br> Design Credits : Technology Literary Society - TLS, IIT Kharagpur", "real_date": "11-09-2016", "created_time": "2016-09-11T14:05:33+0000", "link": "https://www.facebook.com/TSG.IITKharagpur/photos/a.172560726092304.49079.149405445074499/1404389702909394/?type=3", "flag": 1, "real_time": "07:35PM"}, {"pic": "10154398437550132.png", "id": "156819310131_10154398437550132", "source": "The Scholar's Avenue", "message": "The Illumination competition has been reinstated, which means there would be a greater zeal shown by the students of the different Halls of Residence to create their masterpiece.  <br> Courtesy: VP TSG's Timeline", "real_date": "11-09-2016", "created_time": "2016-09-11T09:23:19+0000", "link": "https://www.facebook.com/scholarsavenue/photos/a.294184150131.193021.156819310131/10154398437550132/?type=3", "flag": 1, "real_time": "02:53PM"}, {"pic": "1129295703829840.png", "id": "149405445074499_1129295703829840", "source": "Technology Students Gymkhana", "message": "Aurbataao is a lifestyle gifting website. It has started a campus ambassador program on it's website. <br> Benefits of program:- <br> * Certificate of appreciation from the  <a href=\"http://aurbataao.com\" target=\"_blank\"> aurbataao.com </a>  <br> * Be the official ambassador of aurbataao.com. <br> * Also Promote the Young Leaders to participate in aurbataao.com. <br>  <br>  <a href=\"http://aurbataao.com/campus-ambassador-program/\" target=\"_blank\"> http://aurbataao.com/camp... </a> ", "real_date": "10-09-2016", "created_time": "2016-09-10T10:37:21+0000", "link": "https://www.facebook.com/photo.php?fbid=1129295703829840&set=o.149405445074499&type=3", "flag": 1, "real_time": "04:07PM"}, {"pic": "10154395158895132.png", "id": "156819310131_10154395158895132", "source": "The Scholar's Avenue", "message": "105 CL student from IIT-KGP get 700+ IIM calls in CAT'15. Now it's your turn.  <br> Join Career Launcher's Smart CAT Prep course(MRP.7899/-) at Rs.999/- only. Offer only for students studying in IITKGP not for alumnus. Registration tomorrow (11th September) at VEGIES. Carry 1 photo & ID card. WhatsApp-9051119190 for more details.", "real_date": "10-09-2016", "created_time": "2016-09-10T03:56:47+0000", "link": "https://www.facebook.com/scholarsavenue/photos/a.294184150131.193021.156819310131/10154395158895132/?type=3", "flag": 1, "real_time": "09:26AM"}, {"pic": "1402241216457576.png", "id": "149405445074499_1402241216457576", "source": "Technology Students Gymkhana", "message": "\"Words are singularly the most powerful force available to humanity.\" <br> This is your chance to show your creative writing skills. Send in your entries for The Science of Happiness Challenge by registering at  <a href=\"http://www.happiness-iitkgp.org/happiness/registration.php\" target=\"_blank\"> http://www.happiness-iitk... </a> !! <br> Deadlines have been extended to 18th August!! <br>  <br> Design Credits : Spectra", "real_date": "09-09-2016", "created_time": "2016-09-09T13:40:24+0000", "link": "https://www.facebook.com/TSG.IITKharagpur/photos/a.172560726092304.49079.149405445074499/1402241216457576/?type=3", "flag": 1, "real_time": "07:10PM"}, {"pic": "1044750428980865.png", "id": "149405445074499_1044750428980865", "source": "Technology Students Gymkhana", "message": "There are reasons to think that Technology this time could be different learnt from the experiences of the first generation of the innovation:  <a href=\"http://bit.ly/1UpmdWt\" target=\"_blank\"> http://bit.ly/1UpmdWt </a>  <br> #virtualreality #digitalmarketing #internetofthings #webdesign #outsourcing #datascience", "real_date": "09-09-2016", "created_time": "2016-09-09T09:59:11+0000", "link": "https://www.facebook.com/SureVin/photos/o.149405445074499/1044750428980865/?type=3", "flag": 1, "real_time": "03:29PM"}, {"pic": null, "id": "156819310131_10154393016565132", "source": "The Scholar's Avenue", "message": "Hey everyone!  <br> The mid semester exams scheduled on 13th have been shifted to 22nd, Thursday, owing to the National holiday for Bakr Eid. There is no holiday on Monday, September 12th, which has been shifted to 13th.  <br> Kindly check the Central Examination Timetable on the ERP for more details.", "real_date": "09-09-2016", "created_time": "2016-09-09T09:40:17+0000", "link": null, "flag": 1, "real_time": "03:10PM"}, {"pic": "1388388461189402.png", "id": "149405445074499_1388388461189402", "source": "Technology Students Gymkhana", "message": "\u0906\u0907\u090f.... \u0930\u093e\u0939\u0932\u0941 \u0926\u0947\u0935 \u091c\u0940 \u0938\u0947 \u0938\u0902\u0935\u093e\u0926 \u0915\u0930\u0947\u0902......", "real_date": "09-09-2016", "created_time": "2016-09-09T09:04:32+0000", "link": "https://www.facebook.com/photo.php?fbid=1388388461189402&set=o.149405445074499&type=3", "flag": 1, "real_time": "02:34PM"}, {"pic": "1388387774522804.png", "id": "149405445074499_1388387774522804", "source": "Technology Students Gymkhana", "message": "\u0906\u092a \u0938\u092d\u0940 \u0915\u093e \u0938\u094d\u0935\u093e\u0917\u0924 \u0939\u0948\u0964", "real_date": "09-09-2016", "created_time": "2016-09-09T09:03:14+0000", "link": "https://www.facebook.com/photo.php?fbid=1388387774522804&set=o.149405445074499&type=3", "flag": 1, "real_time": "02:33PM"}, {"pic": "1090044714349216.png", "id": "146188872068143_1210697582283928", "source": "Awaaz IIT Kharagpur", "real_date": "09-09-2016", "created_time": "2016-09-09T08:55:31+0000", "link": "https://www.facebook.com/awaaziitkgp/photos/a.362016570485371.85116.146188872068143/1090044714349216/?type=3", "story": "Awaaz, IIT Kharagpur updated their cover photo.", "real_time": "02:25PM"}, {"pic": null, "id": "146188872068143_1210653068955046", "source": "Awaaz IIT Kharagpur", "message": "Important Notice. <br> All the Exams of 13th September, 2016 have been shifted to 22nd September, 2016 due to Bakr Eid/Eid-ul-Adha festival. (Monday, Sept 12, SHALL NOT BE A HOLIDAY). <br> It is advised to confirm the dates for departmental exams with respective Professors and Exam Co-ordinator. <br>  <br> As per the memorandum released by the Ministry of Personnel, Public Grievances & Pensions, Department of Personnel & Training, Govt. of India and the circular sent therewith, Eid-al-Adha shall be observed throughout the country on 13th instead of 12th of September. The decision from the Central Government comes after the Imarat Shariah did not sight the new moon on Sep 2 that would herald the beginning of the month of Dhu al-Hijjah the next day. This resulted in the lunar month beginning on Sep 4, and since Eid-al-Adha is celebrated on the 10th day of this month, the festival of sacrifice for Muslims will fall on Sept 13 in India. <br>  <br> Please note that all the classes and official activities shall thereof remain administratively suspended on 13th instead of the earlier notification of September 12.", "real_date": "09-09-2016", "created_time": "2016-09-09T07:09:31+0000", "link": null, "flag": 1, "real_time": "12:39PM"}, {"pic": null, "id": "149405445074499_358764461178786", "source": "Technology Students Gymkhana", "message": "Apple has unveiled its long-awaited iPhone 7, featuring waterproofing, a dual-lens camera, no headphone jack and wireless AirPod headphones.", "real_date": "09-09-2016", "created_time": "2016-09-09T00:38:08+0000", "link": "http://www.hopeforeverybody.com/iphone-7-release-date-price-images-specs-and-key-features-of-apples-new-iphone-video-in-the-end-of-the-post/", "flag": 1, "real_time": "06:08AM"}, {"pic": "1401336983214666.png", "id": "149405445074499_1401336983214666", "source": "Technology Students Gymkhana", "message": "IEEE Students' Technology Symposium is an international symposium and flagship event .This year it is hosted in IIT Kharagpur during 30Sep - 02Oct  as a part of which a workshop on creative perception -based alternatives for HCI affecting UX is being conducted . <br> For more details & early bird registration visit :  <a href=\"http://ewh.ieee.org/sb/kharagpur/iitkgp/TechSym2016/speakers_tutorial_workshop_HCI.php\" target=\"_blank\"> http://ewh.ieee.org/sb/kh... </a> ", "real_date": "08-09-2016", "created_time": "2016-09-08T14:30:22+0000", "link": "https://www.facebook.com/TSG.IITKharagpur/photos/a.172560726092304.49079.149405445074499/1401336983214666/?type=3", "flag": 1, "real_time": "08:00PM"}, {"pic": null, "id": "1433721693547904_1727307837522620", "source": "Metakgp", "message": "It's that time of the year again. Get started with your preparation for the mid semester exams with a few previous year Question Papers from MFQP! <br>  <br> If you are unable to see the question papers, add 10.0.0.0/8 to the proxy bypass list on your computer. <br>  <br> On Chrome, Go to Settings -> Advanced Settings -> Change proxy settings -> Now, add 10.0.0.0/8 to your proxy bypass list. <br>  <br>  <a href=\"http://qp.metakgp.org\" target=\"_blank\"> http://qp.metakgp.org </a> /", "real_date": "08-09-2016", "created_time": "2016-09-08T05:46:05+0000", "link": "http://qp.metakgp.org/", "flag": 1, "real_time": "11:16AM"}, {"pic": "1400366356645062.png", "id": "149405445074499_1400366356645062", "source": "Technology Students Gymkhana", "message": "Do you wish to make a difference to your community? Does bringing smiles to the faces of people always give you that feeling of self satisfaction? <br> This is your chance to amaze us with your Project Proposal to make the society around you happier!! <br> Hurry up and register at  <a href=\"http://www.happiness-iitkgp.org/happiness/registration.php\" target=\"_blank\"> http://www.happiness-iitk... </a> !! <br> Grants and prizes worth more than INR 1 lakh up for grabs!!", "real_date": "07-09-2016", "created_time": "2016-09-07T15:45:17+0000", "link": "https://www.facebook.com/TSG.IITKharagpur/photos/a.172560726092304.49079.149405445074499/1400366356645062/?type=3", "flag": 1, "real_time": "09:15PM"}, {"pic": "1209137345773285.png", "id": "156819310131_10154387512720132", "source": "The Scholar's Avenue", "message": "<b>The Scholars' Avenue shared Awaaz, IIT Kharagpur's post.</b> <br>  <br> An RTI filed to the MHRD has revealed that the annual electric bill paid by IIT Kharagpur to the Ministry of Energy & Power Distribution, Govt. of West Bengal, has surged steeply from Rupees 16 crores 18 lakhs in 2011 to an almost double of 31 crores 46 lakhs in 2016. Despite the introduction of several savings and alternative measures like replacement of traditional halogen street lamps with LED, sensor operated lights and installation of solar panels, this sharp upswing whereas can be attributed to an increase in research facilities and functioning of four new halls viz. RLB, LBS, BRH & NVH; it cannot be ruled out completely that the misuse and wastage do not have a colossal rise. The hall and department wise data obtained from the Electric Office unveils that the consumption has increased drastically in almost every hall and department. <br> Many a times we are seen to leave the lights and fans running while we go to the class; not because of our unwillingness but because of our carelessness. We should always remember that there are still 19,706 villages in our India (Data as of 2015, Census Board, Ministry of Home Affairs, Govt. of India) which remain un-electrified even after 69 years of our independence. Around 12% of our population do not know how does it feel to spend nights with lights!  <br>  <br> We, from Awaaz, IIT Kharagpur urge each one of us to please use the electricity and water judiciously and encourage our friends towards the same. After all, every small contribution counts! <br>  <br> \u0938\u092e\u0930 \u0936\u0947\u0937 \u0939\u0948, \u0928\u0939\u0940\u0902 \u092a\u093e\u092a \u0915\u093e \u092d\u093e\u0917\u0940 \u0915\u0947\u0935\u0932 \u0935\u094d\u092f\u093e\u0927, <br> \u091c\u094b \u0924\u091f\u0938\u094d\u0925 \u0939\u0948\u0902 \u0938\u092e\u092f \u0932\u093f\u0916\u0947\u0917\u093e \u0909\u0928\u0915\u093e \u092d\u0940 \u0905\u092a\u0930\u093e\u0927\u0964   - \u0930\u093e\u0937\u094d\u091f\u094d\u0930\u0915\u0935\u093f \u0921\u0949 \u0936\u094d\u0930\u0940 \u0930\u093e\u092e\u0927\u093e\u0930\u0940 \u0938\u093f\u0902\u0939 '\u0926\u093f\u0928\u0915\u0930'", "real_date": "07-09-2016", "created_time": "2016-09-07T12:55:08+0000", "link": "https://www.facebook.com/awaaziitkgp/photos/a.146211918732505.22874.146188872068143/1209137345773285/?type=3", "story": "The Scholars' Avenue shared Awaaz, IIT Kharagpur's post.", "flag": 1, "real_time": "06:25PM"}, {"pic": "1209137345773285.png", "id": "146188872068143_1209156405771379", "source": "Awaaz IIT Kharagpur", "message": "An RTI filed to the MHRD has revealed that the annual electric bill paid by IIT Kharagpur to the Ministry of Energy & Power Distribution, Govt. of West Bengal, has surged steeply from Rupees 16 crores 18 lakhs in 2011 to an almost double of 31 crores 46 lakhs in 2016. Despite the introduction of several savings and alternative measures like replacement of traditional halogen street lamps with LED, sensor operated lights and installation of solar panels, this sharp upswing whereas can be attributed to an increase in research facilities and functioning of four new halls viz. RLB, LBS, BRH & NVH; it cannot be ruled out completely that the misuse and wastage do not have a colossal rise. The hall and department wise data obtained from the Electric Office unveils that the consumption has increased drastically in almost every hall and department. <br> Many a times we are seen to leave the lights and fans running while we go to the class; not because of our unwillingness but because of our carelessness. We should always remember that there are still 19,706 villages in our India (Data as of 2015, Census Board, Ministry of Home Affairs, Govt. of India) which remain un-electrified even after 69 years of our independence. Around 12% of our population do not know how does it feel to spend nights with lights!  <br>  <br> We, from Awaaz, IIT Kharagpur urge each one of us to please use the electricity and water judiciously and encourage our friends towards the same. After all, every small contribution counts! <br>  <br> \u0938\u092e\u0930 \u0936\u0947\u0937 \u0939\u0948, \u0928\u0939\u0940\u0902 \u092a\u093e\u092a \u0915\u093e \u092d\u093e\u0917\u0940 \u0915\u0947\u0935\u0932 \u0935\u094d\u092f\u093e\u0927, <br> \u091c\u094b \u0924\u091f\u0938\u094d\u0925 \u0939\u0948\u0902 \u0938\u092e\u092f \u0932\u093f\u0916\u0947\u0917\u093e \u0909\u0928\u0915\u093e \u092d\u0940 \u0905\u092a\u0930\u093e\u0927\u0964   - \u0930\u093e\u0937\u094d\u091f\u094d\u0930\u0915\u0935\u093f \u0921\u0949 \u0936\u094d\u0930\u0940 \u0930\u093e\u092e\u0927\u093e\u0930\u0940 \u0938\u093f\u0902\u0939 '\u0926\u093f\u0928\u0915\u0930'", "real_date": "07-09-2016", "created_time": "2016-09-07T10:53:32+0000", "link": "https://www.facebook.com/awaaziitkgp/photos/a.146211918732505.22874.146188872068143/1209137345773285/?type=3", "story": "Awaaz, IIT Kharagpur added 4 new photos.", "flag": 1, "real_time": "04:23PM"}, {"pic": "1400165403331824.png", "id": "149405445074499_1400165403331824", "source": "Technology Students Gymkhana", "message": "Presenting another competition in the Science of Happiness Challenge series, we invite applications for the Happiest Posters and Paintings!! <br> Send us your entries by registering yourself at  <a href=\"http://www.happiness-iitkgp.org/happiness/registration.php\" target=\"_blank\"> http://www.happiness-iitk... </a> !! <br> Prizes and grants worth over INR 1 lakh up for grabs!! <br>  <br> You can go through the guidelines at  <a href=\"http://www.happiness-iitkgp.org/happiness/pdf/Project%20Grant-rev.pdf\" target=\"_blank\"> http://www.happiness-iitk... </a>  <br>  <br> Design Credits : Spectra", "real_date": "07-09-2016", "created_time": "2016-09-07T10:29:22+0000", "link": "https://www.facebook.com/TSG.IITKharagpur/photos/a.172560726092304.49079.149405445074499/1400165403331824/?type=3", "flag": 1, "real_time": "03:59PM"}, {"pic": "1400159383332426.png", "id": "149405445074499_1400159383332426", "source": "Technology Students Gymkhana", "message": "Vivekanand Kendra IIT Kharagpur Branch is organizing a lecture on topic \"Lessons of Crisis Management from Ramayana\" to be delivered by Shri. Hanumanth Rao (All India Treasurer, Vivekananda Kendra, Kanyakumari) on 7th September 2016 at 6.00 pm in V1 Hall Vikramshila Complex, IIT Kharagpur.", "real_date": "07-09-2016", "created_time": "2016-09-07T10:16:59+0000", "link": "https://www.facebook.com/TSG.IITKharagpur/photos/a.172560726092304.49079.149405445074499/1400159383332426/?type=3", "flag": 1, "real_time": "03:46PM"}, {"pic": null, "id": "146188872068143_1208699102483776", "source": "Awaaz IIT Kharagpur", "message": "OPEN IIT ENGLISH ELOCUTION <br> The event was organised from 7 pm to 9.30 pm in F-116. Around 40 participants took part in this competition with great zeal and enthusiasm. Students spoke on various topics ranging from racism to environment. Some poems were also recited. In this battle of articulating the ideas with better clarity, expressions and pronunciation, the winners were: <br>  <br> Gold: Abhinav Kumar 15GG20002 Nehru Hall (Requesting a mother to have happiness) <br> Silver: Abhigna Revuru 14PH20029 SN Hall (Role of communication in relationships) <br> Bronze: Krutarth Shah 16IE10014 Azad Hall (Conversation between father and son) <br>  <br> Awaaz, IIT Kharagpur congratulates the winners!", "real_date": "07-09-2016", "created_time": "2016-09-06T19:30:03+0000", "link": null, "flag": 1, "real_time": "01:00AM"}, {"pic": null, "id": "146188872068143_1208685859151767", "source": "Awaaz IIT Kharagpur", "message": "OPEN IIT PRODUCT DESIGN COMPETITION <br> The competition saw a cut throat competition where teams fought neck to neck for a podium finish. The competition was organised in the evening of 6th September. A lot of innovative and brainstorming products were pitched and finally, the winners were: <br>  <br> Gold: Team Innovators (Azad Hall) <br> Silver: Team Prodetors (Prodex) <br> Bronze: Team Smart LED (RK Hall) <br>  <br> Awaaz, IIT Kharagpur congratulates the winners!", "real_date": "07-09-2016", "created_time": "2016-09-06T19:04:29+0000", "link": null, "flag": 1, "real_time": "12:34AM"}, {"pic": "1207188939301459.png", "id": "146188872068143_1207189739301379", "source": "Awaaz IIT Kharagpur", "message": "OPEN IIT CASE STUDY COMPETITION <br>  <br> The Problem Statement involved the How,Whats and Whys of the Commercially Oriented Academic Institutions.After an amazing competition, it were the teams from Azad Hall of Residence that stole the show. Team Innovation from MT Hall of Residence despite performing exceptionally well could not make it to top three owing to the penalty on time limit. <br>  <br> The standings are: <br> First Position was bagged by: <br> Team Azad One & Team Azad Two with 80 points each <br>  <br> Second  Position was bagged by: <br> Team Infinity from RP Hall with 79 points. <br>  <br> Awaaz,IIT Kharagpur heartily congratulates the winning teams. <br>  <br> Here are the pictures of winning teams of Azad and RP respectively.", "real_date": "05-09-2016", "created_time": "2016-09-05T01:30:00+0000", "link": "https://www.facebook.com/awaaziitkgp/photos/a.146211918732505.22874.146188872068143/1207188939301459/?type=3", "story": "Awaaz, IIT Kharagpur added 2 new photos.", "flag": 1, "real_time": "07:00AM"}, {"pic": "820678684619155.png", "id": "146188872068143_1207081952645491", "source": "Awaaz IIT Kharagpur", "message": "A Teacher is not merely a person imparting objective knowledge; a Teacher is one who teaches the way of life, one whose each conduct is conductible. A Teacher, AND ONLY A TEACHER, can affect a student miles away - Swami Vivekananda", "real_date": "05-09-2016", "created_time": "2016-09-04T20:13:04+0000", "link": "https://www.facebook.com/awaaziitkgp/photos/a.362016570485371.85116.146188872068143/820678684619155/?type=3", "story": "Awaaz, IIT Kharagpur updated their cover photo.", "flag": 1, "real_time": "01:43AM"}, {"pic": "1207058482647838.png", "id": "146188872068143_1207065075980512", "source": "Awaaz IIT Kharagpur", "message": "RK Hall successfully conducted the cultural event on the eve of teacher's day. The event witnessed a huge audience and a various number of participants for dramatics, elocution, dance, vocals. <br>  <br> However, it was a whole lot of disappointment for the boarders of RK Hall and the hall council members as well. More than 100 of the boarders were involved in the week-long preparation of the activities and almost the whole hall was involved in its conduction. <br> More than 1000 people from administration and faculty side were invited but only 5-10 people were present, which was very disappointing for the students. While the students did put their heart and soul, they were quite disheartened by the response from the other side. Apart from this, after the movie show for the faculties at Netaji auditorium, students announced about the event and requested professors to stay, still out of total 60 only one of the professors stayed for the cultural evening. <br> Many times we come to hear things from the teachers' side that the culture is diminishing and the teacher-student relation is degrading but the thing is every time the student side cannot be blamed.", "real_date": "05-09-2016", "created_time": "2016-09-04T19:43:13+0000", "link": "https://www.facebook.com/awaaziitkgp/photos/a.146211918732505.22874.146188872068143/1207058482647838/?type=3", "story": "Awaaz, IIT Kharagpur added 9 new photos \u2014 with Aman Verma and 2 others.", "flag": 1, "real_time": "01:13AM"}, {"pic": "1207023902651296.png", "id": "146188872068143_1207025915984428", "source": "Awaaz IIT Kharagpur", "message": "The Open IIT Sketching event saw a huge turnout with students sketching enthusiastically. The three hour long competition produced many good sketches at the end of the day. <br> The top three winners are: <br>  <br> 1.Manad Mishra 16CS30019 (Azad) <br> 2.Shubham Kumar Pandey 16AR10036 (Azad) <br> 3.Samya Samanta 15CY20026 (LLR) <br>  <br> Here are some of the sketches from the competition. <br>  <br> Awaaz, IIT Kharagpur congratulates the winners.", "real_date": "05-09-2016", "created_time": "2016-09-04T18:34:12+0000", "link": "https://www.facebook.com/awaaziitkgp/photos/a.146211918732505.22874.146188872068143/1207023902651296/?type=3", "story": "Awaaz, IIT Kharagpur added 4 new photos.", "flag": 1, "real_time": "12:04AM"}, {"pic": "1206815839338769.png", "id": "146188872068143_1206816876005332", "source": "Awaaz IIT Kharagpur", "message": "Despite heavy rains, a good number of enthusiastic freshers turned up for the treasure hunt event organised by Azad Hall of Residence yesterday. There were many happy and curious faces ready for the adventurous event. The theme of the event was based on Pokemon. Photos show the excitement and enthusiasm among the freshers. Even Lord Indra was not able to beat the tempo of freshers.  <br> Interestingly it's not the first time that it has rained on the day of an event. It has become quite a ritual of raining on days of special events in Kgp.", "real_date": "04-09-2016", "created_time": "2016-09-04T13:07:25+0000", "link": "https://www.facebook.com/awaaziitkgp/photos/a.146211918732505.22874.146188872068143/1206815839338769/?type=3", "story": "Awaaz, IIT Kharagpur added 3 new photos.", "flag": 1, "real_time": "06:37PM"}, {"pic": null, "id": "156819310131_10154375474340132", "source": "The Scholar's Avenue", "message": "What KGP lacks in the absence of high rises, it compensates in the sheer amount of self-motivated student groups or \"societies\" as we call them, that cater to almost all kind of students: creative, intellectual, managerial or welfare inclined. <br>  <br> You just have to name it and you'll have a group of people actively pursuing it. But the question remains, how do we know what exists? Or, how many groups are present here in our campus? <br>  <br> This is a question that might haunt one's brain as soon as they enter the campus, but it soon fades into oblivion and one might miss the chance to get into a society that aligns with their interests. <br>  <br> We finally decided to compile a one-stop list of all the campus societies that we know of till date. <br>  <br> Presenting to you in an interactive format that might just make you forgive Mendeleev a bit. <br>  <br> The Periodic Table of KGPian Societies, everybody! <br>  <br>   <a href=\"https://thescholarsavenue.github.io/societytable/\" target=\"_blank\"> https://thescholarsavenue... </a>  <br>  <br> P.S: Any societies that need any edits in their respective sections can ping us, or mail us (thescholarsavenue@ <a href=\"http://gmail.com\" target=\"_blank\"> gmail.com </a> ) with the edits.  <br> We have only accounted groups that are open to all and are not limited by the Departments and we agree that we might have missed a few nevertheless. <br> Also, this link is not mobile-friendly yet.", "real_date": "03-09-2016", "created_time": "2016-09-03T13:44:08+0000", "link": "https://thescholarsavenue.github.io/societytable/", "flag": 1, "real_time": "07:14PM"}, {"pic": "1094406547303011.png", "id": "1433721693547904_1725340117719392", "source": "Metakgp", "message": "<b>Metakgp shared Kharagpur Open Source Society's photo.</b> <br>  <br> Time for the first event of this session! As they say, any good open source developer worth his (or her) salt uses Linux. As a part of introducing awareness about Open Source in the campus, KOSS, in association with Metakgp and IEEE Student Branch, IIT Kharagpur, is organising the Ubuntu Install Fest.  <br>  <br> Date: 4th September, Sunday <br> Venue: Room 119 - CSE Department <br> Time - 2 to 6 pm. <br>  <br> Be there! <br>  <br> Note: Please bring a pendrive along with your laptop, and ensure there is enough charge for the installation to complete smoothly. <br>  <br> Written instructions:  <a href=\"https://wiki.metakgp.org/w/How_to_install_Ubuntu_as_Dual_Boot\" target=\"_blank\"> https://wiki.metakgp.org/... </a> ", "real_date": "03-09-2016", "created_time": "2016-09-03T10:59:28+0000", "link": "https://www.facebook.com/kossiitkgp/photos/a.551030724973932.1073741826.524856034258068/1094406547303011/?type=3", "story": "Metakgp shared Kharagpur Open Source Society's photo.", "flag": 1, "real_time": "04:29PM"}, {"pic": "1173897242656205.png", "id": "156819310131_10154372063750132", "source": "The Scholar's Avenue", "message": "<b>The Scholars' Avenue shared National Students' Space Challenge's photo.</b> <br>  <br> Here we come!! <br> Schedule NSSC'16 <br> #NSSC", "real_date": "02-09-2016", "created_time": "2016-09-02T13:29:09+0000", "link": "https://www.facebook.com/nssc.iit/photos/a.549260771786525.1073741828.540259992686603/1173897242656205/?type=3", "story": "The Scholars' Avenue shared National Students' Space Challenge's photo.", "flag": 1, "real_time": "06:59PM"}, {"pic": null, "id": "156819310131_10154364477985132", "source": "The Scholar's Avenue", "message": "Good Morning Folks! <br> We hope all your days are running well. The saga of waking up just 5 minutes before class is an everlasting one with consequences that might lead to cycle collisions thanks to some of the new changes in rules around here. But for what it's worth, the IIT tag looms large before you and you might as well put these things at the back of your mind. <br> But there are some things we do look forward to. Scaling the peak of the most coveted institute in the world, the Massachusetts Institute of Technology, is everybody's dream. Getting admission into MIT is an objectively quantified pinnacle of achievement.  <br>  <br> Well, that explains the rat race we were put into from a very young age, right? It means that we, with our degrees and achievements, are the ones who are capable of following this road.  <br> Or does it? <br>  <br> Here is a story that will shatter such narrow conceptions and hopefully rekindle the fire for 'learning' within you. The most important thing in one's life is to question everything and set upon a journey to find the answers. The present system of education is stuck in a deep quagmire of controversy, but in the end it is the passion and interest of a person that will actually propel him/her forward. <br>  <br> Read about the inspiring story here:  <a href=\"http://www.hindustantimes.com/education/17-year-old-unschooled-mumbai-girl-malvika-joshi-makes-it-to-mit/story-EQxDf2NFS5TReDc6Ix3iEJ.html\" target=\"_blank\"> http://www.hindustantimes... </a> ", "real_date": "31-08-2016", "created_time": "2016-08-31T02:50:04+0000", "link": "http://www.hindustantimes.com/education/17-year-old-unschooled-mumbai-girl-malvika-joshi-makes-it-to-mit/story-EQxDf2NFS5TReDc6Ix3iEJ.html", "flag": 1, "real_time": "08:20AM"}, {"pic": "1167534146643605.png", "id": "741132932600291_1167534146643605", "source": "Technology IIT KGP", "message": "Ready, aim and fire! Here we invite all of you to gather and build the future bit by bit. Come aboard on this exhilarating journey of SRM Hackathon which offers the themes of military, women safety, healthcare, tourism, journalism and e-commerce to develop and furnish your masterpiece. So, hurry and submit your ideas on  <a href=\"http://srmhackathon.hackerearth.com\" target=\"_blank\"> srmhackathon.hackerearth.... </a>  on or before 20th September, 2016 <br> Image may contain: indoor", "real_date": "30-08-2016", "created_time": "2016-08-29T21:47:01+0000", "link": "https://www.facebook.com/photo.php?fbid=1167534146643605&set=o.741132932600291&type=3", "flag": 1, "real_time": "03:17AM"}, {"pic": null, "id": "156819310131_10154359701680132", "source": "The Scholar's Avenue", "message": "The West Bengal Legislative Assembly on Monday passed a resolution changing the name of the State to Bengal in English and Bangla in Bengali.  <br>  <br>  <a href=\"http://www.thehindu.com/news/national/other-states/west-bengal-assembly-passes-resolution-for-states-name-change/article9045696.ece\" target=\"_blank\"> http://www.thehindu.com/n... </a> ", "real_date": "29-08-2016", "created_time": "2016-08-29T12:19:01+0000", "link": "http://www.thehindu.com/news/national/other-states/west-bengal-assembly-passes-resolution-for-states-name-change/article9045696.ece", "flag": 1, "real_time": "05:49PM"}, {"pic": "10154357500290132.png", "id": "156819310131_10154357508160132", "source": "The Scholar's Avenue", "message": "AIESEC IIT Kharagpur in collaboration with Gopali Youth Welfare Society organized a social event in JVM, a school run by GYWS. The event symbolized IITians creating a positive impact in the rural India. Here are some pictures from the event 'Balakalakaar'.", "real_date": "28-08-2016", "created_time": "2016-08-28T17:27:27+0000", "link": "https://www.facebook.com/scholarsavenue/photos/a.294184150131.193021.156819310131/10154357500290132/?type=3", "story": "The Scholars' Avenue added 4 new photos.", "flag": 1, "real_time": "10:57PM"}, {"pic": null, "id": "156819310131_10154347902985132", "source": "The Scholar's Avenue", "message": "The IIT Council has started working towards its aims of improving the global status of IITs as a research hub. <br> The Plans include:  \"to fill 20 per cent vacancies with foreign faculty, allow off-campus PhD students, 20% international students at undergraduate and postgraduate level, a 1:7 faculty-student ratio and separate capital grants for world class infrastructure.\"", "real_date": "25-08-2016", "created_time": "2016-08-25T13:15:00+0000", "link": "http://economictimes.indiatimes.com/industry/services/education/iit-council-clears-project-vishwajeet-to-raise-iits-at-par-with-the-worlds-best/articleshow/53846768.cms", "flag": 1, "real_time": "06:45PM"}, {"pic": "1386052004743164.png", "id": "741132932600291_1135159046531009", "source": "Technology IIT KGP", "message": "<b>Technology, IIT Kharagpur shared Technology Students' Gymkhana, IIT Kharagpur's photo.</b> <br>  <br> Open IIT Case Study: <br> Problem Statement Release: 27th August, 6 pm <br> Presentation: 4th September. 6:30 pm, V4 <br> Contact General Secretaries Technology of your respective halls for detailed information. <br>  <br> Design Credits: Md Faraz Akhtar", "real_date": "23-08-2016", "created_time": "2016-08-23T15:18:27+0000", "link": "https://www.facebook.com/TSG.IITKharagpur/photos/a.172560726092304.49079.149405445074499/1386052004743164/?type=3", "story": "Technology, IIT Kharagpur shared Technology Students' Gymkhana, IIT Kharagpur's photo.", "flag": 1, "real_time": "08:48PM"}, {"pic": null, "id": "1433721693547904_1718565165063554", "source": "Metakgp", "message": "Moving forward with our aim to curate information important to KGPians, we have started to collect \"How To\"s on metakgp. From guides about Institute formalities, like getting bonafide certificates and transcripts, to how-to's about travel and visas, our list goes on. The best thing is, metakgp is a wiki, this means **anyone** can edit it. So please add your own How To's to make things better. <br>  <br>  <a href=\"https://wiki.metakgp.org/w/List_of_how-tos\" target=\"_blank\"> https://wiki.metakgp.org/... </a> ", "real_date": "17-08-2016", "created_time": "2016-08-17T12:23:36+0000", "link": "http://giphy.com/gifs/how-to-metakgp-3oz8xqWsVPcmpHfdhm", "flag": 1, "real_time": "05:53PM"}, {"pic": null, "id": "1433721693547904_1714405645479506", "source": "Metakgp", "message": "We having a hackday tomorrow. In a hackday we come together and hack on something. **Absolutely everyone is invited**, it doesn't matter which year you are in, it doesn't matter whether you have been involved with metakgp or not and it doesn't matter if you know much programming or not. We believe everyone will have something to contribute and everyone will be able to learn something from the hackday. You can come with your own ideas or work with someone with the ideas listed below. The ideas need not be related to metaKGP or coding, for that matter. <br>  <br> Venue: Group Study Room, 2nd Floor Annex Building Central Library <br>  <br> Time: 1 PM to 8 PM <br>  <br>  <a href=\"https://wiki.metakgp.org/w/Metakgp:Meetups/2016-08-07\" target=\"_blank\"> https://wiki.metakgp.org/... </a> ", "real_date": "06-08-2016", "created_time": "2016-08-06T13:08:37+0000", "link": "https://wiki.metakgp.org/w/Metakgp:Meetups/2016-08-07", "flag": 1, "real_time": "06:38PM"}, {"pic": null, "id": "1433721693547904_1714405505479520", "source": "Metakgp", "message": "We're having a hackday tomorrow. In a hackday we come together and hack on something. Absolutely everyone is invited, it doesn't matter which year you are in, it doesn't matter you have been involved with metakgp or not and it doesn't matter if you know much programming or not. We believe everyone will have something to contribute and everyone will be able to learn something from the hackday. You can come with your own ideas or work with someone with the ideas listed below. The ideas need not be related to metakgp or coding for that matter. <br>  <br> Venue: Group Study Room, 2nd Floor Annex Building Central Library <br>  <br> Time: 1 PM to 8 PM <br>  <br>  <a href=\"https://wiki.metakgp.org/w/Metakgp:Meetups/2016-08-07\" target=\"_blank\"> https://wiki.metakgp.org/... </a>  <br>  <br> Please message us if you have any questions. See you there :)", "real_date": "06-08-2016", "created_time": "2016-08-06T13:08:10+0000", "link": null, "flag": 1, "real_time": "06:38PM"}, {"pic": null, "id": "1433721693547904_1713277238925680", "source": "Metakgp", "message": "The Metakgp Book Club is meeting today at 6:30 PM, Wednesday in the Discussion room, Annex Building, Central Library. You can hear people speak about a book they've read in recent past and later discuss it with the group. And of course, you're also invited to speak. <br>  <br> Check out  <a href=\"https://wiki.metakgp.org/w/Metakgp:Book_Club\" target=\"_blank\"> https://wiki.metakgp.org/... </a> ", "real_date": "03-08-2016", "created_time": "2016-08-03T09:47:58+0000", "link": "https://wiki.metakgp.org/w/Metakgp:Book_Club", "flag": 1, "real_time": "03:17PM"}, {"pic": null, "id": "741132932600291_1421100797903962", "source": "Technology IIT KGP", "message": "Can't keep your mind off electrical stuff? This is your chance to unveil your electrifying side to others and exhibit that you have enough potential to make a difference! Participate in Circuitrix Junior and win BONUS MARKS for taking admission in IIIT-Delhi, along with amazing prizes. <br>  <br> Registration is now LIVE! <br>  <br> To register, fill in this form:  <a href=\"http://bit.ly/circuitrixjr-esya16\" target=\"_blank\"> bit.ly/circuitrixjr-esya1... </a>  <br> To know more, visit our website :  <a href=\"http://esya.iiitd.edu.in\" target=\"_blank\"> http://esya.iiitd.edu.in </a> / <br>  <br> Note: This competition is only open for students currently in classes XI and XII.", "real_date": "02-08-2016", "created_time": "2016-08-01T20:02:28+0000", "link": "http://bit.ly/circuitrixjr-esya16", "flag": 1, "real_time": "01:32AM"}, {"pic": null, "id": "1433721693547904_1710491929204211", "source": "Metakgp", "message": "Still confused about which Elective to take? Check the previous year grade distribution of your course on metakgp. Just Search for your course number or page. Unfortunately we don't have every page, but perfect is the enemy of good. <br>  <br>  <a href=\"https://wiki.metakgp.org/w/Main_Page\" target=\"_blank\"> https://wiki.metakgp.org/... </a> ", "real_date": "27-07-2016", "created_time": "2016-07-26T20:14:00+0000", "link": "https://giphy.com/gifs/l46ChFECkpg71rOXm", "flag": 1, "real_time": "01:44AM"}, {"pic": null, "id": "741132932600291_1097927463587501", "source": "Technology IIT KGP", "message": "<b>Technology, IIT Kharagpur shared Technology Students' Gymkhana, IIT Kharagpur's post.</b> <br>  <br> SRISTI celebrates the creativity and innovation of young technological students by recognising their outstanding projects with Gandhian Young Technological Innovation (GYTI) Awards. These awards are given every year during the Festival of Innovation (FOIN) at Rashtrapati Bhawan in the month of March. Next year, these awards are due tentatively on March 5, 2017 at FOIN. It is hoped that such recognition will enthuse young innovators to pursue even more outstanding research addressing unmet social needs and set up entrepreneurial ventures in consonance with Start-Up movement gaining strength currently in India. <br> Any student project that has been completed during 2014-15 to 2016-17 is eligible for consideration of awards.The students need to submit the projects at following URL: www.gyti.techpedia.in.  <br>  <br> Financial support is also given to some of the awardees as per numerous windows of opportunity: <br>  <br> Last date for submission of entries is November 30, 2016 <br>  <br> You can email your queries to gyti.techpedia@sristi.org ,or call at 9099258492.", "real_date": "02-07-2016", "created_time": "2016-07-02T15:37:49+0000", "link": "http://www.gyti.techpedia.in/", "story": "Technology, IIT Kharagpur shared Technology Students' Gymkhana, IIT Kharagpur's post.", "flag": 1, "real_time": "09:07PM"}, {"pic": null, "id": "1433721693547904_1692532067666864", "source": "Metakgp", "message": "Next in our list of featured articles is **Table Tennis**. <br>  <br> \"Table Tennis is one of the 13 sports which is a part of the General Championship during Inter IIT Sports Meet. IIT Kharagpur has a separate building (generally referred to as the Old Gymkhana) dedicated to Table Tennis, just behind the Volleyball Court and beside Iosys. It has 4 Stag 1000 DX table tennis boards, and a matted floor.\" <br>  <br>  <a href=\"https://wiki.metakgp.org/w/Table_Tennis\" target=\"_blank\"> https://wiki.metakgp.org/... </a> ", "real_date": "06-06-2016", "created_time": "2016-06-05T18:49:39+0000", "link": "https://wiki.metakgp.org/w/Table_Tennis", "flag": 1, "real_time": "12:19AM"}, {"pic": null, "id": "1433721693547904_1675356086051129", "source": "Metakgp", "message": "We are happy to announce that Central Library website now links to our question paper search! <br>  <br>  <a href=\"http://library.iitkgp.ernet.in\" target=\"_blank\"> http://library.iitkgp.ern... </a> / <br>  <a href=\"http://metakgp.github.io/mfqp/\" target=\"_blank\"> http://metakgp.github.io/... </a> ", "real_date": "19-04-2016", "created_time": "2016-04-19T17:01:49+0000", "link": "http://gph.is/26dk2cv", "flag": 1, "real_time": "10:31PM"}, {"pic": null, "id": "741132932600291_1051679094879005", "source": "Technology IIT KGP", "message": "<b>Technology, IIT Kharagpur shared IIT KGP Sports's post.</b> <br>  <br> The venue of The Annual Gymkhana Awards Distribution Ceremony has been shifted from Kalidas Auditiorium to Netaji Auditorium. The function will begin at 6 PM today (18th of April, 2016).  <br> All are invited to attend this Award Distribution Ceremony.", "real_date": "18-04-2016", "created_time": "2016-04-18T05:32:12+0000", "link": "https://www.facebook.com/sports.iitkgp/posts/1615613715327789", "story": "Technology, IIT Kharagpur shared IIT KGP Sports's post.", "flag": 1, "real_time": "11:02AM"}, {"pic": null, "id": "741132932600291_1051336474913267", "source": "Technology IIT KGP", "message": "Gymkhana Awards (Technology) 2015-16: <br>  <br> 1) Prof. G S Sanyal Cup: <br> ASHISH DAGA <br>  <br> 2)Order of merit: <br> SAUMARIC DANGWAL <br> ARIJIT PATRA <br> NAVEEN CHAKRAVARTHY <br> APURVA GAJWANI <br> RAUNAK DHANIWALA <br> ARPIT KUMAR AGARWAL <br> Y R RAVITEJA VARMA <br>  <br> 3)Honorable mention: <br> DIGANT PANDEY <br> ANKESH ANAND <br> ARPIT TARANG SAXENA <br> M A KRISHNA DEEPAK <br> ANKIT KUMAR SINHA <br> ABHISHEK ARIJIT <br> ANUPAM PEDRALA <br> RUPESH BANSAL <br>  <br> Technology Students' Gymkhana congratulates the awards recipients!", "real_date": "17-04-2016", "created_time": "2016-04-17T15:18:51+0000", "link": null, "flag": 1, "real_time": "08:48PM"}, {"pic": null, "id": "1433721693547904_1673349162918488", "source": "Metakgp", "message": "Featured today: Encore! Some of its alumni have turned into KGP legends over the years :) <br>  <br> \"ENCORE selection auditions are held once per year, only for first years, in August for an active membership for all four/five years. The society selects a batch of 30-40 first years (UG) and 5-10 (PG) at the beginning of the academic year soon after the welcome production. Selection procedure consists of tasks that judge voice modulation, intensity, speech and diction, confidence and acting skills. <br>  <br> In rare cases, exceptional and highly enthusiastic people are also inducted into ENCORE who share a similar passion of theater and contribute to the society. Past members who were inducted include Kaustabh Khare.\" <br>  <br>  <a href=\"https://wiki.metakgp.org/w/Encore\" target=\"_blank\"> https://wiki.metakgp.org/... </a> ", "real_date": "13-04-2016", "created_time": "2016-04-13T16:52:43+0000", "link": "https://wiki.metakgp.org/w/Encore", "flag": 1, "real_time": "10:22PM"}, {"pic": null, "id": "741132932600291_1046085325438382", "source": "Technology IIT KGP", "message": "Gymkhana awards 2015 - 2016 <br>  <br> Application for the gymkhana awards in the genre of technology are invited for  <br>  <br> 1) Prof. G S Sanyal Cup. <br> 2) Order of merit. <br> 3) Hon'ble mention. <br> 4) Ashoke Mukherjee Cup (Outgoing student who has made outstanding voluntary contribution to the Gymkhana) <br>  <br> CVs should be mailed to gymkhana.kharagpur@ <a href=\"http://gmail.com\" target=\"_blank\"> gmail.com </a>  by 11/04/2016 at 6pm. All the relevant documents (supporting points mentioned in the CV) should be mailed along with the CV. <br>  <br> In the resumes following information can be included: <br>  <br> *Participation in the GC. <br> *Position of responsibilities. <br> *Participation in tech events (eg. KTJ, out station participation). <br> *Inter IIT Tech achievements.  <br> *Meaningful projects and technical papers. <br> *National/International conferences. <br>  <br> Regards", "real_date": "09-04-2016", "created_time": "2016-04-08T20:00:45+0000", "link": null, "flag": 1, "real_time": "01:30AM"}, {"pic": "1018169361563312.png", "id": "741132932600291_1018169914896590", "source": "Technology IIT KGP", "message": "Interactive session with Prof. John Mather witnessed an overwhelming response from students and faculty members alike. <br>  <br> We are sincerely thankful to Prof. Somesh Kumar to make the event successful.", "real_date": "01-03-2016", "created_time": "2016-03-01T01:41:35+0000", "link": "https://www.facebook.com/iitkgp.tech/photos/a.741165312597053.1073741827.741132932600291/1018169361563312/?type=3", "story": "Technology, IIT Kharagpur added 6 new photos \u2014 with Vedasheersh Boorla and Somesh Kumar.", "flag": 1, "real_time": "07:11AM"}, {"pic": "1015934581786790.png", "id": "741132932600291_1015934581786790", "source": "Technology IIT KGP", "message": "A senior astrophysicist at NASA, Prof. Mather is the recipient of 2006 Nobel prize in Physics. He is a senior project scientist at JSWT, which will be successor to Hubble Space Telescope. He was part of the COBE satellite, which confirmed the Big Bang theory. He was listed twice by TIME magazine; among 100 most influential people in the world in 2007 and then again in 2012 among 25 most influential people in space. <br>  <br> Strengthen the foundation of your thoughts through his precious words. <br>  <br> Date: 29th February (Monday), 6:30 PM <br> Venue: CET Studio 1, First Floor, Takshashila", "real_date": "26-02-2016", "created_time": "2016-02-26T09:25:33+0000", "link": "https://www.facebook.com/iitkgp.tech/photos/a.741165312597053.1073741827.741132932600291/1015934581786790/?type=3", "flag": 1, "real_time": "02:55PM"}, {"pic": "1008987672481481.png", "id": "741132932600291_1008987672481481", "source": "Technology IIT KGP", "message": "A PAN IIT interactive session with Prof. Herald Haas has been arranged on 14th February at 6:30PM. Prof. Haas holds the Chair of Mobile Communications at the University of Edinburgh. He is acclaimed to be the inventor of Light Fidelity (Li-Fi) which was listed among the 50 best inventions in TIME Magazine 2011. <br>  <br> Link for webcast is  <a href=\"http://nknvcreplay.nic.in/replay/webcastShow.html?key=vUUIZ1dDHHitrBr\" target=\"_blank\"> http://nknvcreplay.nic.in... </a>  <br>  <br> Link will be live from Sunday (14th Feb.) 6:30 PM onward. Venue for online interaction is NKN Virtual Classroom, JCB Lab Complex. <br>  <br> Note: The event will consist of a keynote speech from 6:30 PM - 8:00 PM. Q&A session will be from 8:15 PM.", "real_date": "13-02-2016", "created_time": "2016-02-13T15:15:05+0000", "link": "https://www.facebook.com/iitkgp.tech/photos/a.741165312597053.1073741827.741132932600291/1008987672481481/?type=3", "flag": 1, "real_time": "08:45PM"}, {"pic": null, "id": "741132932600291_1002196383160610", "source": "Technology IIT KGP", "message": "IIT Kharagpur has won the 4th Inter IIT Tech General Championship winning the General Championship for a continuous 2nd time in a row. <br>  <br> Results of all Events: <br>  <br> Social Media Analysis: <br> 1st. IIT Kharagpur <br> 2nd. IIT Mandi <br> 3rd. IIT Madras <br>  <br> Internet of Things: <br> 1st. IIT Madras <br> 2nd. IIT Kanpur and IIT Kharagpur <br> 3rd. IIT Patna <br>  <br> Tech Quiz: <br> 1st. IIT Ropar <br> 2nd. IIT Kanpur <br> 3rd. IIT Bhubaneshwar <br>  <br> Embedded Systems: <br> 1st. IIT Kharagpur <br> 2nd. IIT Kanpur <br> 3rd. IIT Mandi <br>  <br> Software Development: <br> 1st. IIT Kharagpur <br> 2nd. IIT Kanpur <br> 3rd. IIT Mandi <br>  <br> Product Exhibition: <br> 1st. IIT Kharagpur <br> 2nd. IIT Kharagpur <br> 3rd. IIT Madras <br>  <br> Portfolio Defender: <br> 1st. IIT Kharagpur <br> 2nd. IIT Mandi <br> 3rd. IIT Madras <br>  <br> Hardware Modelling <br> 1st. IIT Kharagpur <br> 2nd. IIT Kanpur <br> 3rd. IIT Roorkee. <br>  <br> Congratulations to all the winners!!", "real_date": "31-01-2016", "created_time": "2016-01-31T16:50:17+0000", "link": null, "flag": 1, "real_time": "10:20PM"}]